{
  "schema_version": "1.0",
  "handoff_id": "11111111-1111-1111-1111-111111111111",
  "custody_id": "CUST-2026-0001",
  "processed_at": "2026-06-14T12:30:00Z",
  "processed_by": "WhisperBOT",
  "model_used": "whisper-large-v3",
  "status": "success",
  "error": null,
  "transcript": {
    "path": "/vault/processed/CUST-2026-0001.txt",
    "format": "txt",
    "word_count": 4200,
    "sha256": "bbbbbbbbbbbbbbbbbbbbbbbbbbbbbbbbbbbbbbbbbbbbbbbbbbbbbbbbbbbbbbbb"
  },
  "diarization": {
    "available": true,
    "speaker_count": 2,
    "path": "/vault/processed/CUST-2026-0001.diarization.json"
  },
  "confidence": {
    "overall": 0.94,
    "low_confidence_segments": 3
  },
  "artifacts": [
    {
      "type": "transcript",
      "path": "/vault/processed/CUST-2026-0001.txt",
      "sha256": "bbbbbbbbbbbbbbbbbbbbbbbbbbbbbbbbbbbbbbbbbbbbbbbbbbbbbbbbbbbbbbbb"
    }
  ]
}
